"","id","target","response","autoscore","trial number","rewardcue","cents","ParticipantID"
"1998","5e3f7b63badc6c1db1be6647"," FATHER HUGGED SAD DAUGHTER","the father had to side the house",25,78,"$$$",15.625,"25"
"1999","5e3f7b63badc6c1db1be6647"," PRETTY GIRL WON PRIZE","the pretty girl won the prize",100,79,"$$$",62.5,"25"
"2000","5e3f7b63badc6c1db1be6647"," BOY CARRIED SMALL RABBIT","the boy carried the small daughter",75,80,"$$$",46.875,"25"
"2001","5e460227ac32e30e541f9789"," BOSS BOUGHT NEW CAR","false falls",0,1,"0",0,"26"
"2002","5e460227ac32e30e541f9789"," MOTHER BAKED DELICIOUS COOKIES","other baking",0,2,"0",0,"26"
"2003","5e460227ac32e30e541f9789"," DOCTOR HELPED SICK PATIENT","the doctor has a patient",50,3,"0",0,"26"
"2004","5e460227ac32e30e541f9789"," COUPLE EXPECTED NEW BABY","the catholic",0,4,"0",0,"26"
"2005","5e460227ac32e30e541f9789"," AUTHOR TOLD INTERESTING STORY","the author told an interesting story",100,5,"0",0,"26"
"2006","5e460227ac32e30e541f9789"," BOSS MET NEW CUSTOMERS","the boss met the pet supplies",50,6,"0",0,"26"
"2007","5e460227ac32e30e541f9789"," BALL BROKE GLASS WINDOW","the ball broke a glass table",75,7,"0",0,"26"
"2008","5e460227ac32e30e541f9789"," HORSE MADE LOUD NOISE","none",0,8,"0",0,"26"
"2009","5e460227ac32e30e541f9789"," HUNGRY RABBIT ATE CARROTS","the hungry rabbit ate carrots",100,9,"0",0,"26"
"2010","5e460227ac32e30e541f9789"," TEAM PLAYED DIFFICULT GAME","he went to the gate",0,10,"0",0,"26"
"2011","5e460227ac32e30e541f9789"," CUSTOMERS HATED BLACK TEA","customers hated the black",75,11,"0",0,"26"
"2012","5e460227ac32e30e541f9789"," DARK HOUSE SCARED BABY","dark lives",25,12,"0",0,"26"
"2013","5e460227ac32e30e541f9789"," COUPLE WANTED YOUNGEST CHILD","the couple went to the gym",25,13,"0",0,"26"
"2014","5e460227ac32e30e541f9789"," WOMAN MET RICH ACTOR","the beverage",0,14,"0",0,"26"
"2015","5e460227ac32e30e541f9789"," TINY FLIES BOTHERED GIRL","time flies per hour",25,15,"0",0,"26"
"2016","5e460227ac32e30e541f9789"," CHEF COOKED DELICIOUS FOOD","the chef cooked the food",75,16,"0",0,"26"
"2017","5e460227ac32e30e541f9789"," RICH BOYFRIEND OWNED HOUSES","the rich party in the house",25,17,"$$$",15.625,"26"
"2018","5e460227ac32e30e541f9789"," HARDWORKING FARMER GREW CORN","hard looking",0,18,"$$$",0,"26"
"2019","5e460227ac32e30e541f9789"," MONKEY MADE HORRIBLE NOISE","the monkey made the house",50,19,"$$$",31.25,"26"
"2020","5e460227ac32e30e541f9789"," HOT COFFEE HURT BOY","the hot coffee",50,20,"$$$",31.25,"26"
"2021","5e460227ac32e30e541f9789"," YOUNGEST SISTER WATCHED PARADE","the youngest sister",50,21,"0",0,"26"
"2022","5e460227ac32e30e541f9789"," PROFESSOR GAVE UNFAIR GRADE","the professor gave the girl her grade",75,22,"0",0,"26"
"2023","5e460227ac32e30e541f9789"," FOOTBALL PLAYER WON PRIZE","the football player won the game",75,23,"0",0,"26"
"2024","5e460227ac32e30e541f9789"," MOTHER DRANK ORANGE JUICE","the mother drank the juice",75,24,"0",0,"26"
"2025","5e460227ac32e30e541f9789"," MAN ATE LARGE MEAL","a large",25,25,"0",0,"26"
"2026","5e460227ac32e30e541f9789"," FAMILY WATCHED TALENTED PERFORMER","the family watched the town",50,26,"0",0,"26"
"2027","5e460227ac32e30e541f9789"," CAT CHASED GRAY GREY MOUSE","the cat chased the gray mouse",100,27,"0",0,"26"
"2028","5e460227ac32e30e541f9789"," TROUBLED CHILD NEEDED MOTHER","the troubled child needed help",75,28,"0",0,"26"
"2029","5e460227ac32e30e541f9789"," MONKEY WANTED YELLOW BANANA","the monkey wanted to eat the banana",75,29,"0",0,"26"
"2030","5e460227ac32e30e541f9789"," SCHOOL NEEDED NEW TEACHER","someone",0,30,"0",0,"26"
"2031","5e460227ac32e30e541f9789"," BOY CARRIED HEAVY CHAIR","the boy carried the heavy chair",100,31,"0",0,"26"
"2032","5e460227ac32e30e541f9789"," ENGLISH STUDENT READ BOOK","the english student",50,32,"0",0,"26"
"2033","5e460227ac32e30e541f9789"," GRANDFATHER CHOSE OLD MOVIE","the grandfather",25,33,"0",0,"26"
"2034","5e460227ac32e30e541f9789"," BLACK BEAR SCARED VISITORS","the black bear scares",50,34,"0",0,"26"
"2035","5e460227ac32e30e541f9789"," GRAY GREY MOUSE ATE CHEESE","the gray mouse ate the cheese",100,35,"0",0,"26"
"2036","5e460227ac32e30e541f9789"," THIRSTY DOG DRANK WATER","the thirsty dog drank water",100,36,"0",0,"26"
"2037","5e460227ac32e30e541f9789"," WOMAN HEARD BEAUTIFUL SONG","the lemon sang a song",25,37,"$$$",15.625,"26"
"2038","5e460227ac32e30e541f9789"," TRAVELERS VISITED NEW MUSEUM","the travelers had a tiny",25,38,"$$$",15.625,"26"
"2039","5e460227ac32e30e541f9789"," MEAN BEAR ATE FRUIT","the mean bear ate the supplies",75,39,"$$$",46.875,"26"
"2040","5e460227ac32e30e541f9789"," TALENTED AUTHOR RECEIVED PRIZE","the talented author seemed tired",50,40,"$$$",31.25,"26"
"2041","5e460227ac32e30e541f9789"," TALENTED MUSICIAN KNEW SONGS","the talented position",25,41,"0",0,"26"
"2042","5e460227ac32e30e541f9789"," CHILDREN LIKED FRESH VEGETABLES","the children liked the illustration",50,42,"0",0,"26"
"2043","5e460227ac32e30e541f9789"," SOFT MUSIC PLEASED BOSS","the soft",25,43,"0",0,"26"
"2044","5e460227ac32e30e541f9789"," MEAN CHILDREN BROKE RULES","the mean children",50,44,"0",0,"26"
"2045","5e460227ac32e30e541f9789"," DOCTOR OWNED YELLOW CAR","the doctor owned the yellow car",100,45,"0",0,"26"
"2046","5e460227ac32e30e541f9789"," WIND DESTROYED TINY HOUSE","the wind strung the townhouse",25,46,"0",0,"26"
"2047","5e460227ac32e30e541f9789"," CHEF CHOSE DELICIOUS CHEESE","the chef shows the cheese",50,47,"0",0,"26"
"2048","5e460227ac32e30e541f9789"," SMALL FAMILY PLAYED GAME","the small family lived in",50,48,"0",0,"26"
"2049","5e460227ac32e30e541f9789"," BROTHER MET TALENTED ARTIST","the brother met",50,49,"0",0,"26"
"2050","5e460227ac32e30e541f9789"," GRANDFATHER MADE WOODEN CHAIR","the grandfather knew the chair",50,50,"0",0,"26"
"2051","5e460227ac32e30e541f9789"," NEIGHBOR LIKED LOUD SONG","the neighbor lit the house on fire",25,51,"0",0,"26"
"2052","5e460227ac32e30e541f9789"," TEACHER WROTE DIFFICULT QUESTION","the cheerful",0,52,"0",0,"26"
"2053","5e460227ac32e30e541f9789"," NURSE CLEANED DIRTY CLOTHES","the marist",0,53,"0",0,"26"
"2054","5e460227ac32e30e541f9789"," FATHER HUGGED SAD DAUGHTER","the father had to",25,54,"0",0,"26"
"2055","5e460227ac32e30e541f9789"," PRETTY GIRL WON PRIZE","the pretty girl wore the dress",50,55,"0",0,"26"
"2056","5e460227ac32e30e541f9789"," BOY CARRIED SMALL RABBIT","the boy carried a small",75,56,"0",0,"26"
"2057","5e460227ac32e30e541f9789"," PRETTY WOMAN LIKED COOKIES","the pretty women liked the caboose",50,57,"$$$",31.25,"26"
"2058","5e460227ac32e30e541f9789"," HOT SUN WARMED TEA","the hot sun warmed the air",75,58,"$$$",46.875,"26"
"2059","5e460227ac32e30e541f9789"," TEACHER CHOSE DIFFICULT QUESTION","the teacher chose the student",50,59,"$$$",31.25,"26"
"2060","5e460227ac32e30e541f9789"," SMALL ANIMAL SCARED BABY","the small animals scurried away",25,60,"$$$",15.625,"26"
"2061","5e460227ac32e30e541f9789"," PRESIDENT GAVE INTERESTING SPEECH","the president gave a speech",75,61,"0",0,"26"
"2062","5e460227ac32e30e541f9789"," MAN HEARD BEAUTIFUL MUSIC","the man hurried away",25,62,"0",0,"26"
"2063","5e460227ac32e30e541f9789"," LARGE MONKEY CHASED CHILD","the large monkey chased the",75,63,"0",0,"26"
"2064","5e460227ac32e30e541f9789"," FAMILY CLEANED DIRTY HOUSE","the family lived in the yellow house",50,64,"0",0,"26"
"2065","5e460227ac32e30e541f9789"," HORRIBLE STORY UPSET GRANDMOTHER","the horrible story",50,65,"0",0,"26"
"2066","5e460227ac32e30e541f9789"," LOUD NOISE UPSET BABY","the loud noise upset the baby",100,66,"0",0,"26"
"2067","5e460227ac32e30e541f9789"," GRAY GREY RABBIT LOVED CARROTS","the little rabbit loved the carrots",75,67,"0",0,"26"
"2068","5e460227ac32e30e541f9789"," SON LOVED TOY CAR","the son loved the car",75,68,"0",0,"26"
"2069","5e460227ac32e30e541f9789"," STORE SOLD DIRTY CLOTHES","soldier",0,69,"0",0,"26"
"2070","5e460227ac32e30e541f9789"," MAN ATE FRESH PEPPERS","the man ate the fresh peppers",100,70,"0",0,"26"
"2071","5e460227ac32e30e541f9789"," SMALL BOY CHOSE GAME","the small boy chased the game",75,71,"0",0,"26"
"2072","5e460227ac32e30e541f9789"," SMALL RESTAURANT NEEDED MONEY","the small restaurant needed money",100,72,"0",0,"26"
"2073","5e460227ac32e30e541f9789"," MAN SHARED DIFFICULT STORY","the man shared the story",75,73,"0",0,"26"
"2074","5e460227ac32e30e541f9789"," BOSS TOLD HORRIBLE JOKE","the boss sold a women",25,74,"0",0,"26"
"2075","5e460227ac32e30e541f9789"," GIRL LOVED SWEET COFFEE","the girl loved the small coffee",75,75,"0",0,"26"
"2076","5e460227ac32e30e541f9789"," STRONG FATHER CARRIED BROTHER","the strong father carried",75,76,"0",0,"26"
"2077","5e460227ac32e30e541f9789"," BUSY DAUGHTER JOINED MUSEUM","the busy daughter joined the gymnasium",75,77,"$$$",46.875,"26"
"2078","5e460227ac32e30e541f9789"," PLAYER HURT LEFT HAND","the mayor heard his",0,78,"$$$",0,"26"
"2079","5e460227ac32e30e541f9789"," TALENTED DOCTOR SAVED CHILD","the talented doctor saved the child",100,79,"$$$",62.5,"26"
"2080","5e460227ac32e30e541f9789"," THREE SISTERS SHARED CLOTHES","the three sisters shared the clothes",100,80,"$$$",62.5,"26"
"2081","5ecb09cc5bb88d670255817a"," PRETTY WOMAN LIKED COOKIES","he himself had to perform",0,1,"0",0,"27"
"2082","5ecb09cc5bb88d670255817a"," HOT SUN WARMED TEA","he himself countless applied",0,2,"0",0,"27"
"2083","5ecb09cc5bb88d670255817a"," TEACHER CHOSE DIFFICULT QUESTION","he had chosen which house to apply",0,3,"0",0,"27"
"2084","5ecb09cc5bb88d670255817a"," SMALL ANIMAL SCARED BABY","he was a small man couch reply",25,4,"0",0,"27"
"2085","5ecb09cc5bb88d670255817a"," GRANDFATHER CHOSE OLD MOVIE","grandfather chosen",25,5,"0",0,"27"
"2086","5ecb09cc5bb88d670255817a"," BLACK BEAR SCARED VISITORS","scared in the house",25,6,"0",0,"27"
"2087","5ecb09cc5bb88d670255817a"," GRAY GREY MOUSE ATE CHEESE","out of housing supplies",0,7,"0",0,"27"
"2088","5ecb09cc5bb88d670255817a"," THIRSTY DOG DRANK WATER","dog drank the water",75,8,"0",0,"27"
"2089","5ecb09cc5bb88d670255817a"," BUSY DAUGHTER JOINED MUSEUM","his daughter Jenny",25,9,"0",0,"27"
"2090","5ecb09cc5bb88d670255817a"," PLAYER HURT LEFT HAND","heard he left helpless",25,10,"0",0,"27"
"2091","5ecb09cc5bb88d670255817a"," TALENTED DOCTOR SAVED CHILD","two daughters saved the jet",25,11,"0",0,"27"
"2092","5ecb09cc5bb88d670255817a"," THREE SISTERS SHARED CLOTHES","after checking his sisters true",25,12,"0",0,"27"
"2093","5ecb09cc5bb88d670255817a"," BROTHER MET TALENTED ARTIST","the brother left and",25,13,"0",0,"27"
"2094","5ecb09cc5bb88d670255817a"," GRANDFATHER MADE WOODEN CHAIR","he ran through the neighborhood",0,14,"0",0,"27"
"2095","5ecb09cc5bb88d670255817a"," NEIGHBOR LIKED LOUD SONG","he lit the house on fire",0,15,"0",0,"27"
"2096","5ecb09cc5bb88d670255817a"," TEACHER WROTE DIFFICULT QUESTION","each of them houses",0,16,"0",0,"27"
"2097","5ecb09cc5bb88d670255817a"," HORRIBLE STORY UPSET GRANDMOTHER","normal story of separate exits",25,17,"$$$",15.625,"27"
"2098","5ecb09cc5bb88d670255817a"," LOUD NOISE UPSET BABY","alone in his upset beak",25,18,"$$$",15.625,"27"
"2099","5ecb09cc5bb88d670255817a"," GRAY GREY RABBIT LOVED CARROTS","the green rabbit loved the carrots",75,19,"$$$",46.875,"27"
"2100","5ecb09cc5bb88d670255817a"," SON LOVED TOY CAR","the son loved his carrot",50,20,"$$$",31.25,"27"
"2101","5ecb09cc5bb88d670255817a"," NURSE CLEANED DIRTY CLOTHES","the man swiftly led off",0,21,"0",0,"27"
"2102","5ecb09cc5bb88d670255817a"," FATHER HUGGED SAD DAUGHTER","father hunted the sad boy",50,22,"0",0,"27"
"2103","5ecb09cc5bb88d670255817a"," PRETTY GIRL WON PRIZE","pretty girl won the primaries",75,23,"0",0,"27"
"2104","5ecb09cc5bb88d670255817a"," BOY CARRIED SMALL RABBIT","the boy carried the small brown bag",75,24,"0",0,"27"
"2105","5ecb09cc5bb88d670255817a"," MAN SHARED DIFFICULT STORY","men should know that the first",0,25,"0",0,"27"
"2106","5ecb09cc5bb88d670255817a"," BOSS TOLD HORRIBLE JOKE","boss told her many",50,26,"0",0,"27"
"2107","5ecb09cc5bb88d670255817a"," GIRL LOVED SWEET COFFEE","the girl loved his sweet talk",75,27,"0",0,"27"
"2108","5ecb09cc5bb88d670255817a"," STRONG FATHER CARRIED BROTHER","the strong man carried her",50,28,"0",0,"27"
"2109","5ecb09cc5bb88d670255817a"," BOSS BOUGHT NEW CAR","boss bought her",50,29,"0",0,"27"
"2110","5ecb09cc5bb88d670255817a"," MOTHER BAKED DELICIOUS COOKIES","the mother made her delicious cookies",75,30,"0",0,"27"
"2111","5ecb09cc5bb88d670255817a"," DOCTOR HELPED SICK PATIENT","the doctor followed the sick patient",75,31,"0",0,"27"
"2112","5ecb09cc5bb88d670255817a"," COUPLE EXPECTED NEW BABY","the couple expected a new baby",100,32,"0",0,"27"
"2113","5ecb09cc5bb88d670255817a"," MAN ATE LARGE MEAL","the man ate a large meal",100,33,"0",0,"27"
"2114","5ecb09cc5bb88d670255817a"," FAMILY WATCHED TALENTED PERFORMER","the family watched the toddler's recital",50,34,"0",0,"27"
"2115","5ecb09cc5bb88d670255817a"," CAT CHASED GRAY GREY MOUSE","the cat chased the gray mouse",100,35,"0",0,"27"
"2116","5ecb09cc5bb88d670255817a"," TROUBLED CHILD NEEDED MOTHER","the troubled child needed help",75,36,"0",0,"27"
"2117","5ecb09cc5bb88d670255817a"," YOUNGEST SISTER WATCHED PARADE","the youngest sister watches her little brother",50,37,"$$$",31.25,"27"
"2118","5ecb09cc5bb88d670255817a"," PROFESSOR GAVE UNFAIR GRADE","the professor gave an unfair grade",100,38,"$$$",62.5,"27"
"2119","5ecb09cc5bb88d670255817a"," FOOTBALL PLAYER WON PRIZE","the football player won the prize",100,39,"$$$",62.5,"27"
"2120","5ecb09cc5bb88d670255817a"," MOTHER DRANK ORANGE JUICE","the mother drank the cheez-its",50,40,"$$$",31.25,"27"
"2121","5ecb09cc5bb88d670255817a"," TALENTED MUSICIAN KNEW SONGS","the talented musician played his songs",75,41,"0",0,"27"
"2122","5ecb09cc5bb88d670255817a"," CHILDREN LIKED FRESH VEGETABLES","the children liked the reddish balloons",50,42,"0",0,"27"
"2123","5ecb09cc5bb88d670255817a"," SOFT MUSIC PLEASED BOSS","the soft music plays lost",50,43,"0",0,"27"
"2124","5ecb09cc5bb88d670255817a"," MEAN CHILDREN BROKE RULES","many child have a loss",0,44,"0",0,"27"
"2125","5ecb09cc5bb88d670255817a"," STORE SOLD DIRTY CLOTHES","the swim soul swam loose",0,45,"0",0,"27"
"2126","5ecb09cc5bb88d670255817a"," MAN ATE FRESH PEPPERS","the man ate the fresh puppies",75,46,"0",0,"27"
"2127","5ecb09cc5bb88d670255817a"," SMALL BOY CHOSE GAME","the small boy chased the goat",50,47,"0",0,"27"
"2128","5ecb09cc5bb88d670255817a"," SMALL RESTAURANT NEEDED MONEY","the small restaurant needed knives",75,48,"0",0,"27"
"2129","5ecb09cc5bb88d670255817a"," DOCTOR OWNED YELLOW CAR","the doctor owned the yellow copcar",75,49,"0",0,"27"
"2130","5ecb09cc5bb88d670255817a"," WIND DESTROYED TINY HOUSE","he then destroyed the tiny house",75,50,"0",0,"27"
"2131","5ecb09cc5bb88d670255817a"," CHEF CHOSE DELICIOUS CHEESE","the chef shows the toughest cheese",50,51,"0",0,"27"
"2132","5ecb09cc5bb88d670255817a"," SMALL FAMILY PLAYED GAME","the small family lived in a gated community",50,52,"0",0,"27"
"2133","5ecb09cc5bb88d670255817a"," PRESIDENT GAVE INTERESTING SPEECH","the president gave an interesting speech",100,53,"0",0,"27"
"2134","5ecb09cc5bb88d670255817a"," MAN HEARD BEAUTIFUL MUSIC","the man heard the house on fire",50,54,"0",0,"27"
"2135","5ecb09cc5bb88d670255817a"," LARGE MONKEY CHASED CHILD","the large monkey chased the chidl",75,55,"0",0,"27"
"2136","5ecb09cc5bb88d670255817a"," FAMILY CLEANED DIRTY HOUSE","the family cleaned the dirty house",100,56,"0",0,"27"
"2137","5ecb09cc5bb88d670255817a"," HUNGRY RABBIT ATE CARROTS","the hungry rabbit ate the carrots",100,57,"$$$",62.5,"27"
"2138","5ecb09cc5bb88d670255817a"," TEAM PLAYED DIFFICULT GAME","the teeny child had the",0,58,"$$$",0,"27"
"2139","5ecb09cc5bb88d670255817a"," CUSTOMERS HATED BLACK TEA","customers hated the blonde team",50,59,"$$$",31.25,"27"
"2140","5ecb09cc5bb88d670255817a"," DARK HOUSE SCARED BABY","dark house scared the",75,60,"$$$",46.875,"27"
"2141","5ecb09cc5bb88d670255817a"," WOMAN HEARD BEAUTIFUL SONG","none of the child abusers saw the bike",0,61,"0",0,"27"
"2142","5ecb09cc5bb88d670255817a"," TRAVELERS VISITED NEW MUSEUM","childhood visit was in New Zealand",25,62,"0",0,"27"
"2143","5ecb09cc5bb88d670255817a"," MEAN BEAR ATE FRUIT","the lone bear ate the fry",50,63,"0",0,"27"
"2144","5ecb09cc5bb88d670255817a"," TALENTED AUTHOR RECEIVED PRIZE","the talented author received the prize",100,64,"0",0,"27"
"2145","5ecb09cc5bb88d670255817a"," AUTHOR TOLD INTERESTING STORY","the author told an interesting story",100,65,"0",0,"27"
"2146","5ecb09cc5bb88d670255817a"," BOSS MET NEW CUSTOMERS","the boss met the new customers",100,66,"0",0,"27"
"2147","5ecb09cc5bb88d670255817a"," BALL BROKE GLASS WINDOW","the boss voted last week",0,67,"0",0,"27"
"2148","5ecb09cc5bb88d670255817a"," HORSE MADE LOUD NOISE","the large will persuade the ease",0,68,"0",0,"27"
"2149","5ecb09cc5bb88d670255817a"," COUPLE WANTED YOUNGEST CHILD","the couple went the end checked",25,69,"0",0,"27"
"2150","5ecb09cc5bb88d670255817a"," WOMAN MET RICH ACTOR","the woman in bed owned a tractor",25,70,"0",0,"27"
"2151","5ecb09cc5bb88d670255817a"," TINY FLIES BOTHERED GIRL","the tiny flies puckered the call",50,71,"0",0,"27"
"2152","5ecb09cc5bb88d670255817a"," CHEF COOKED DELICIOUS FOOD","the chef cooked the delicious food",100,72,"0",0,"27"
"2153","5ecb09cc5bb88d670255817a"," MONKEY WANTED YELLOW BANANA","the murky water yellow band",25,73,"0",0,"27"
"2154","5ecb09cc5bb88d670255817a"," SCHOOL NEEDED NEW TEACHER","someone aided the",0,74,"0",0,"27"
"2155","5ecb09cc5bb88d670255817a"," BOY CARRIED HEAVY CHAIR","the boy carried the heavy chair",100,75,"0",0,"27"
"2156","5ecb09cc5bb88d670255817a"," ENGLISH STUDENT READ BOOK","none",0,76,"0",0,"27"
"2157","5ecb09cc5bb88d670255817a"," RICH BOYFRIEND OWNED HOUSES","the arch guard strolled among the houses",25,77,"$$$",15.625,"27"
"2158","5ecb09cc5bb88d670255817a"," HARDWORKING FARMER GREW CORN","we are looking for a man to court",0,78,"$$$",0,"27"
"2159","5ecb09cc5bb88d670255817a"," MONKEY MADE HORRIBLE NOISE","the monkey made the poor blues",50,79,"$$$",31.25,"27"
"2160","5ecb09cc5bb88d670255817a"," HOT COFFEE HURT BOY","they all had coffee and",25,80,"$$$",15.625,"27"
"2161","5eac4e861dfe0309c93974b5"," BOSS BOUGHT NEW CAR","he himself bald spot",0,1,"0",0,"28"
"2162","5eac4e861dfe0309c93974b5"," MOTHER BAKED DELICIOUS COOKIES","he himself bother bathe cook",0,2,"0",0,"28"
"2163","5eac4e861dfe0309c93974b5"," DOCTOR HELPED SICK PATIENT","he himself doctor said how should apply",25,3,"0",0,"28"
"2164","5eac4e861dfe0309c93974b5"," COUPLE EXPECTED NEW BABY","he himseld spectator house",0,4,"0",0,"28"
"2165","5eac4e861dfe0309c93974b5"," HORRIBLE STORY UPSET GRANDMOTHER","he himself horrible sore",25,5,"0",0,"28"
"2166","5eac4e861dfe0309c93974b5"," LOUD NOISE UPSET BABY","he himself house apply",0,6,"0",0,"28"
"2167","5eac4e861dfe0309c93974b5"," GRAY GREY RABBIT LOVED CARROTS","he himself gray rabbits loved carrots",75,7,"0",0,"28"
"2168","5eac4e861dfe0309c93974b5"," SON LOVED TOY CAR","he himseld sun",0,8,"0",0,"28"
"2169","5eac4e861dfe0309c93974b5"," TALENTED MUSICIAN KNEW SONGS","he himself musician true",25,9,"0",0,"28"
"2170","5eac4e861dfe0309c93974b5"," CHILDREN LIKED FRESH VEGETABLES","he himself not relent request",0,10,"0",0,"28"
"2171","5eac4e861dfe0309c93974b5"," SOFT MUSIC PLEASED BOSS","he himself softly please his boss",25,11,"0",0,"28"
"2172","5eac4e861dfe0309c93974b5"," MEAN CHILDREN BROKE RULES","house request",0,12,"0",0,"28"
"2173","5eac4e861dfe0309c93974b5"," BROTHER MET TALENTED ARTIST","brother",25,13,"0",0,"28"
"2174","5eac4e861dfe0309c93974b5"," GRANDFATHER MADE WOODEN CHAIR","grandfather knew how to",25,14,"0",0,"28"
"2175","5eac4e861dfe0309c93974b5"," NEIGHBOR LIKED LOUD SONG","In April lies",0,15,"0",0,"28"
"2176","5eac4e861dfe0309c93974b5"," TEACHER WROTE DIFFICULT QUESTION","none",0,16,"0",0,"28"
"2177","5eac4e861dfe0309c93974b5"," STORE SOLD DIRTY CLOTHES","none",0,17,"$$$",0,"28"
"2178","5eac4e861dfe0309c93974b5"," MAN ATE FRESH PEPPERS","Man ate the fresh packets",75,18,"$$$",46.875,"28"
"2179","5eac4e861dfe0309c93974b5"," SMALL BOY CHOSE GAME","Small boy chased the gator",50,19,"$$$",31.25,"28"
"2180","5eac4e861dfe0309c93974b5"," SMALL RESTAURANT NEEDED MONEY","Small restraunt",25,20,"$$$",15.625,"28"
"2181","5eac4e861dfe0309c93974b5"," MAN ATE LARGE MEAL","Man ate the large meatball",75,21,"0",0,"28"
"2182","5eac4e861dfe0309c93974b5"," FAMILY WATCHED TALENTED PERFORMER","family watched from the tall tower",50,22,"0",0,"28"
"2183","5eac4e861dfe0309c93974b5"," CAT CHASED GRAY GREY MOUSE","the cat chased the gray mouse",100,23,"0",0,"28"
"2184","5eac4e861dfe0309c93974b5"," TROUBLED CHILD NEEDED MOTHER","troubled child needed",75,24,"0",0,"28"
"2185","5eac4e861dfe0309c93974b5"," MAN SHARED DIFFICULT STORY","the man shared",50,25,"0",0,"28"
"2186","5eac4e861dfe0309c93974b5"," BOSS TOLD HORRIBLE JOKE","the boss scolded",25,26,"0",0,"28"
"2187","5eac4e861dfe0309c93974b5"," GIRL LOVED SWEET COFFEE","the girl loved to sweet talk",75,27,"0",0,"28"
"2188","5eac4e861dfe0309c93974b5"," STRONG FATHER CARRIED BROTHER","none",0,28,"0",0,"28"
"2189","5eac4e861dfe0309c93974b5"," PRESIDENT GAVE INTERESTING SPEECH","the president would introduce a speech",50,29,"0",0,"28"
"2190","5eac4e861dfe0309c93974b5"," MAN HEARD BEAUTIFUL MUSIC","man heard the house had water",50,30,"0",0,"28"
"2191","5eac4e861dfe0309c93974b5"," LARGE MONKEY CHASED CHILD","large monkey chased the child",100,31,"0",0,"28"
"2192","5eac4e861dfe0309c93974b5"," FAMILY CLEANED DIRTY HOUSE","the family played with their cats",25,32,"0",0,"28"
"2193","5eac4e861dfe0309c93974b5"," AUTHOR TOLD INTERESTING STORY","the others told interesting stories",50,33,"0",0,"28"
"2194","5eac4e861dfe0309c93974b5"," BOSS MET NEW CUSTOMERS","the boss met the",50,34,"0",0,"28"
"2195","5eac4e861dfe0309c93974b5"," BALL BROKE GLASS WINDOW","none",0,35,"0",0,"28"
"2196","5eac4e861dfe0309c93974b5"," HORSE MADE LOUD NOISE","the horse made the loud noise",100,36,"0",0,"28"
"2197","5eac4e861dfe0309c93974b5"," GRANDFATHER CHOSE OLD MOVIE","the grandfather chose the old one",75,37,"$$$",46.875,"28"
"2198","5eac4e861dfe0309c93974b5"," BLACK BEAR SCARED VISITORS","the black bear scared the",75,38,"$$$",46.875,"28"
"2199","5eac4e861dfe0309c93974b5"," GRAY GREY MOUSE ATE CHEESE","the gray mouse ate some cheese",100,39,"$$$",62.5,"28"
"2200","5eac4e861dfe0309c93974b5"," THIRSTY DOG DRANK WATER","the thirsty dog drank the water",100,40,"$$$",62.5,"28"
"2201","5eac4e861dfe0309c93974b5"," RICH BOYFRIEND OWNED HOUSES","the rich boyfriend had a housewife",50,41,"0",0,"28"
"2202","5eac4e861dfe0309c93974b5"," HARDWORKING FARMER GREW CORN","the hardworking farmer",50,42,"0",0,"28"
"2203","5eac4e861dfe0309c93974b5"," MONKEY MADE HORRIBLE NOISE","the monkey made the horse",50,43,"0",0,"28"
"2204","5eac4e861dfe0309c93974b5"," HOT COFFEE HURT BOY","none",0,44,"0",0,"28"
"2205","5eac4e861dfe0309c93974b5"," YOUNGEST SISTER WATCHED PARADE","the youngest sister",50,45,"0",0,"28"
"2206","5eac4e861dfe0309c93974b5"," PROFESSOR GAVE UNFAIR GRADE","the professor gave a grade",75,46,"0",0,"28"
"2207","5eac4e861dfe0309c93974b5"," FOOTBALL PLAYER WON PRIZE","the football player won a prize",100,47,"0",0,"28"
"2208","5eac4e861dfe0309c93974b5"," MOTHER DRANK ORANGE JUICE","the mother tried on new shoes",25,48,"0",0,"28"
"2209","5eac4e861dfe0309c93974b5"," NURSE CLEANED DIRTY CLOTHES","the nurse",25,49,"0",0,"28"
"2210","5eac4e861dfe0309c93974b5"," FATHER HUGGED SAD DAUGHTER","the father was sad all",50,50,"0",0,"28"
"2211","5eac4e861dfe0309c93974b5"," PRETTY GIRL WON PRIZE","the pretty girl won the prize",100,51,"0",0,"28"
"2212","5eac4e861dfe0309c93974b5"," BOY CARRIED SMALL RABBIT","the boy carried the small pack of water",75,52,"0",0,"28"
"2213","5eac4e861dfe0309c93974b5"," BUSY DAUGHTER JOINED MUSEUM","the busy daughter joined the museum",100,53,"0",0,"28"
"2214","5eac4e861dfe0309c93974b5"," PLAYER HURT LEFT HAND","the player hurt his left hand",100,54,"0",0,"28"
"2215","5eac4e861dfe0309c93974b5"," TALENTED DOCTOR SAVED CHILD","trauma dotors saved the child",50,55,"0",0,"28"
"2216","5eac4e861dfe0309c93974b5"," THREE SISTERS SHARED CLOTHES","the three little sisters will share the clothes",75,56,"0",0,"28"
"2217","5eac4e861dfe0309c93974b5"," WOMAN HEARD BEAUTIFUL SONG","the mama bird sang her song",25,57,"$$$",15.625,"28"
"2218","5eac4e861dfe0309c93974b5"," TRAVELERS VISITED NEW MUSEUM","the travelers weren't using",25,58,"$$$",15.625,"28"
"2219","5eac4e861dfe0309c93974b5"," MEAN BEAR ATE FRUIT","the mean bear ate the squirell",75,59,"$$$",46.875,"28"
"2220","5eac4e861dfe0309c93974b5"," TALENTED AUTHOR RECEIVED PRIZE","the talented author recieved the prize",75,60,"$$$",46.875,"28"
"2221","5eac4e861dfe0309c93974b5"," MONKEY WANTED YELLOW BANANA","none",0,61,"0",0,"28"
"2222","5eac4e861dfe0309c93974b5"," SCHOOL NEEDED NEW TEACHER","the small",0,62,"0",0,"28"
"2223","5eac4e861dfe0309c93974b5"," BOY CARRIED HEAVY CHAIR","the boy carried the heavy chair",100,63,"0",0,"28"
"2224","5eac4e861dfe0309c93974b5"," ENGLISH STUDENT READ BOOK","the English student house",50,64,"0",0,"28"
"2225","5eac4e861dfe0309c93974b5"," PRETTY WOMAN LIKED COOKIES","the pretty compulse",25,65,"0",0,"28"
"2226","5eac4e861dfe0309c93974b5"," HOT SUN WARMED TEA","the hot sun warmed the two",75,66,"0",0,"28"
"2227","5eac4e861dfe0309c93974b5"," TEACHER CHOSE DIFFICULT QUESTION","the teacher chose to",50,67,"0",0,"28"
"2228","5eac4e861dfe0309c93974b5"," SMALL ANIMAL SCARED BABY","the small animal sipped water",50,68,"0",0,"28"
"2229","5eac4e861dfe0309c93974b5"," DOCTOR OWNED YELLOW CAR","the doctor owned the yellow car",100,69,"0",0,"28"
"2230","5eac4e861dfe0309c93974b5"," WIND DESTROYED TINY HOUSE","the wind destroyed the town house",75,70,"0",0,"28"
"2231","5eac4e861dfe0309c93974b5"," CHEF CHOSE DELICIOUS CHEESE","the chef chose the delicious cheese",100,71,"0",0,"28"
